{
  "contract_version": "cad-auto-dimension-request/0.1",
  "footprint": {
    "outer_ring_mm": [[0, 0], [12000, 0], [12000, 8000], [0, 8000]]
  },
  "walls": [
    {"wall_ref": "wall-south", "kind": "exterior", "start_mm": [0, 0], "end_mm": [12000, 0], "thickness_mm": 365},
    {"wall_ref": "wall-hall", "kind": "interior", "start_mm": [2000, 4000], "end_mm": [10000, 4000], "thickness_mm": 115}
  ],
  "openings": [
    {"opening_ref": "front-door", "wall_ref": "wall-south", "kind": "door", "offset_from_start_mm": 4800, "width_mm": 1100},
    {"opening_ref": "hall-door", "wall_ref": "wall-hall", "kind": "interior_door", "offset_from_start_mm": 2800, "width_mm": 885}
  ],
  "options": {
    "external_offset_mm": 1000,
    "internal_offset_mm": 350,
    "chain_spacing_mm": 450,
    "include_external": true,
    "include_internal": true
  }
}
